Asker,Responder,Question,Answer,Clear,Assertive,Cautious,Optimistic,Specific,Relevant
Maynard Um,Suresh Vasudevan,"Hi. Thanks. I'm a little puzzled about your competitive intensity and pricing comment. You got two large competitors, if you look at their gross margins this quarter they have been fairly stable quarter-over-quarter. So I'm wondering if this intensity is something that's more recent, is it just now you decided to be more reactionary this quarter versus last quarter? And then separately last year your sales and marketing spends grew 4.7 million sequentially and it sounds like you're going to be investing more. So should we use that as a benchmark to look at a growth north of that for this quarter or is that not a good benchmark to look at? Thanks.","Let me take the first comment, Maynard. When I said the competitive intensity is higher, we are certainly seeing that reflected in longer sales cycle. We are seeing instances where discount of 90 points off are not just one-off, but fairly frequent and so we certainly are seeing a more aggressive pricing response from our some NetApp, EMC and others than we did in prior quarters. Now, there is a second factor that is also very relevant. The mix of large deals is moving up substantially for us every quarter. And so even as we see our larger deal that's really where they are more aggressive, so for us the impact is somewhat more exaggerated because more of our deals now are coming from greater than $0.5 million, greater than $250,000 deals they are being much more aggressive about defending share.",,,,,,
Maynard Um,Anup Singh,"Hi. Thanks. I'm a little puzzled about your competitive intensity and pricing comment. You got two large competitors, if you look at their gross margins this quarter they have been fairly stable quarter-over-quarter. So I'm wondering if this intensity is something that's more recent, is it just now you decided to be more reactionary this quarter versus last quarter? And then separately last year your sales and marketing spends grew 4.7 million sequentially and it sounds like you're going to be investing more. So should we use that as a benchmark to look at a growth north of that for this quarter or is that not a good benchmark to look at? Thanks.","And the question around the increase in sales and marketing, the guidance we’ve given for Q4 that accounts for the increase in expenses that we see across the board. So hopefully it’ll give you an idea to the OpEx trends there.

",,,,,,
James Kisner,Anup Singh,"Hi, thanks for taking my question. Just question about cash and cash management, so I was wondering given the velocity to make a more concerted efforts that net working capital out of certain opportunity on the table to preserve cash and I know you have a pretty good balance here right now, but do you have a minimum balance in mind in terms of cash in your balance sheet to run your business and to ensure customers?
","Yes, James so the good news on cash if you look at our cash situation for all of last year we basically were breakeven in cash. For the first three quarters of this year so far our cash is actually slightly up. And actually as we look ahead to Q4 which is usually a better quarter for us from a linearity standpoint we expect our cash to go up in Q4, right? So I think again we're not offering any guidance for next year, but I would say that so far we’ve been growing our business, we’ve been making investments and still we’ve been avoiding a burning of cash situation as a company.

",,,,,,
Richard Kugele,Suresh Vasudevan,"Thank you. Good afternoon. I want to take a bigger question here. Suresh if you had to look back over the past calls, even just four quarters, how much do you think you've forsaken on growth at the expense of keeping the costs down to hit this breakeven for next quarter. How much growth do you think it cost you? And then looking at it another way, with the investment that you are making what do you think the company should be growing at? Because clearly you must have a target in mind in order to invest properly.","Yes. Good question. So, let me go back to the first part of your question, Rich. When I talk about -- I want to underscore one comment, which is the competitive intensity we are seeing and some of the comments I made about large deals taking longer and impacting our pipeline conversion while that’s going on the commercial segment overall our win rates did not change much as a company. In the commercial segment we have a very proven model that generates a very well understood pattern of return and the shift in investment is really what caused us to actually lose some steam on the commercial segment. And so as I go back to the first part of your question, this idea of managing our operating expense envelope within a certain guideline did cause that shift and that's really what cost us our growth because fundamentally our investment in commercial are still bearing fruit with the same pattern and we know that making those investments will get that growth back for us. That is not a place where we are seeing all of the competitive intensity that I've been describing. So that’s the first comment I would make. That's also what's guiding our next steps which is making the investments back in commercial will return us to growth, it will take a couple of quarters for those investments to take to bear fruit, but second half of next year we do expect to reaccelerate growth. Now, in terms of a specific target for growth for a specific long-term number, I'm not going to give you more specific than that which other than to say we always offer it with certain growth aspirations, which shows this quarter because of the investment correcting that we believe will return us back to being able to have those same aspirations.",,,,,,
Richard Kugele,Suresh Vasudevan,"Okay. Then just lastly, if you adjust for currency, you're mix versus the midpoint was only $3.5 million, but the increase in the operating loss was double. So the difference there is the increase investments on the enterprise. Is that the way we should look at that?","So the impact of the currency has a big negative effect on our operating income because the majority of our cost certainly manufacturing we saw in North America revenue is reported international. So the impact on revenue was 2.8 million, the impact on operating income was about 1.5 million this quarter.
",,,,,,
Kulbinder Garcha,Suresh Vasudevan,Thanks for taking my question. I guess my first one is for Suresh. On the choices you guys are making with respect to investment I guess how does that change running the business going forward because it seems you were making some trade-off between commercial enterprises which impacted given the revenue line.And given your state of penetration of both segments very early I guess you need to have a lot more premium managing that cost base going forward and does that inject certain volatility into your results sort of think about how you think about managing the business going forward? And then clarification to revenue let's say miss that you guys are seeing is it because you lost deals and its really because the pricing environment is causing elongated sales cycle is that what you're saying just to be clear?,"Start with the second one which is the revenue decrease we are seeing is on the higher end, it’s the elongated sales cycle and the fact that in larger deals our win rates have been always sort of more challenge than in our lower end deals. And so I want to say the mix shift towards larger deals fits the explanation that you have given.The second reason for the revenue shortfall is that we did not have enough investments in our commercial business which translates into opportunity generation and pipeline and that's what we're reinvesting it. So that's just to give you a sense that both drivers were in place for us this quarter. On the larger question of what is our investment philosophy I will start by saying if I take a three year perspective, not much has changed from our perspective on what's likely to happen in this market. There is still a shift from disk centric architectures to flash centric architectures. We absolutely believe we have the broadest flash platform and one of the investments that we mentioned is in broadening the flash platform to address every form of deploying flash. And so we fundamentally believe that that shift is not being challenged and that legacy vendors will not be able to fight that shift back. So with that said, the constraint investment is what led us to not have as much growth as we aspired to. So we are going to invest more in the first half. I will also say that this is not at the same time abandonment of the belief that you need to both have the growth as well as operating leverage and that's why we believe in the second half you'll see operating leverage back compared to this year second half in our business model. So we continue to improve operating leverage and that will be the guideline we will use to drive our investments.",,,,,,
Kulbinder Garcha,Suresh Vasudevan,And then maybe just one other one asking the question with respect to your pricing in other way. If you guys were to become more aggressive with your own pricing would that really change your revenue outlook means for you over the next couple of quarters given it's more elongated sales cycles and discussion and larger deal size in the shift -- should I guess the concern is what is in the six month time we're talking about gross margin in the low 60s because this is a new industry environment. Do you or not you not see that as a risk right now?,"Now I think -- I still feel very comfortable in the target gross margin model we have used. There's still a lot of room between where we operate and what the target model looks like. I also want to underscore, we have very strong win rates in the high end. It just happens to be the win rates are different from what we have enlisted 100K deals, the half a million dollar deal. So we have very strong win rates on the high end and the pricing is not fundamentally stopping our progress. I answered an earlier question by saying our growth rate in larger deals, growth rate in Fibre Channel are all above the company growth rate. And so that still making really good progress. I'm not at a point where I feel like we have to abandon our gross margin model at all. We very much feel that we can maintain that gross margin model.",,,,,,
Keith Bachman,Suresh Vasudevan,"Hi. I wanted to come back to that last point. A couple of observations. One you've made the comment essentially that the profit pool of the storage time that you are pursuing has declined because of pricing pressure. In kind you are actually making more investments to respond to that so you're actually participating in the lower profit pool, combined with it's just not clear to me that NetApp, HP, EMC and Hitachi are going to change their behavior. You could argue they keep getting aggressive to keep their systems in place even if it's below cost just to secure the maintenance streams associated with it. So I'm unclear. You’ve said a couple of different times you think you can generate leverage in the second half of next year. I don't think you’ve made the case why. It's not clear that you actually can return or improve your leverage even as we look out over a period of time. So I’d like to hear why you think you can improve your leverage, your profit rates given the backdrop?

","I’m happy to address that, Keith. If you look at where we are placing our investments, the big investment we are making in our commercial segment. That's adding commercial teams and in programs aimed at driving opportunity generation for the productivity of our commercial teams. Today our mature commercial teams operate well above breakeven levels of productivity. And so investments we make and we also have a very well understood pattern of how long it takes for us to bring on a commercial team, how long it takes for us to get that commercial team to be on the same curve as a mature team and that is on the outside four quarters. Now some of the investments we make will not just help with new teams we bring on they actually make our existing teams more productive as well. So, we are very confident that the first investment stream that directed at our commercial segment has a well understood pattern of payoff, pulling investment from that is what cost us growth, putting investment back there we know will not just drive growth, but also drive operating leverage. The second investment we're making is really in broadening our flash platform which is aimed at the large deal segment. I want to say one other thing. In the large deal segment, even as I said the price competition our win rates there are healthy. Well that's what's driving a faster growth for us in that segment. Fibre Channel is now almost a quarter of the mix of protocols. It was just 17.5% a quarter ago, right? So we're seeing really good progress there broadening our flash platform will only help that segment as well. That's sort of how I think about the investments and why they are not just supportive of growth but they are supportive of leverage as well.",,,,,,
Keith Bachman,Suresh Vasudevan,"Okay. How long does a company and the Board pursue this strategy before possibly considering other strategic alternatives? In other words if you -- another couple of quarters margins don't improve and indeed pricing persists which could cause ongoing pressure on the business, how long does the company look at that before deciding perhaps make different strategic choices?


","At this point I think we've given you a sense for how we are thinking about our business model which is the investments we make will bring us into the same sort -- will impact our leverage in the first half of this year and the second half will improve our leverage. The reality is that from a cash perspective so far this year, we have essentially generated cash. So this is a business that is not burned cash all through this year. When you look at some of our competitors and you contrast our approach to cash management it's extremely prudent. We are not anywhere close to abandoning the prudent approach to managing cash and so I don't feel like we're taking undue risks. These are well understood investments that we know have a good return. So, I think at this point that is really the outlook on how we want to operate our business model.",,,,,,
Keith Bachman,Anup Singh,"Okay. How long does a company and the Board pursue this strategy before possibly considering other strategic alternatives? In other words if you -- another couple of quarters margins don't improve and indeed pricing persists which could cause ongoing pressure on the business, how long does the company look at that before deciding perhaps make different strategic choices?


","So, Keith, this is Anup. I just want to add something that Suresh said in terms of the confidence in the leverage in the model we are going forward. So we talk about the time to maturity of sales team that we bring on board, just to give you a perspective. So, less than 60% of the team that we have on board are actually in the mature category. So we have a lot of teams on board that we’ve brought on in the last year that we expect will improve the P&L in the back half of next year.",,,,,,
Joe Wittine,Anup Singh,"Hi. Thank you. About a forward question. Should we expect down seasonality in April? I know you won't guide specifically, but at least talk us through it. You've been kind of growth enough up until now to offset any down seasonality, so its talking through that it could prevent a potential surprise 90 days from now because I think still is modeling some sequential growth in April. Thanks.","Yeah. And Joe, this is Anup. We said a few times in the past that Q1 obviously for us in the industry as a whole is seasonally down as a quarter. As a matter of fact when you look at some of the larger companies, these guys are down in double-digits in Q1 from Q4. As we start to do our modeling out and so on for next year, we absolutely should expect seasonality as well to impact to our numbers.
",,,,,,
