Asker,Responder,Question,Answer,Clear,Assertive,Cautious,Optimistic,Specific,Relevant
Jason Ader,Suresh Vasudevan,"Thank you. Suresh, my question is about competition. If you had to characterize the impact from the incumbent defending share versus some of the upstarts that are spending aggressively to take share, how would you characterize the impact of each?","Jason, during Q3 the incumbents accounted for almost the entire competitive intensity increase that we saw specifically the top four incumbents accounted for over 70% of the competitive engagement that we are in and that's really where we saw very aggressive pricing and other actions that impacted us.

",,,,,,
Jason Ader,Suresh Vasudevan,"Just a quick follow-up on that so if the -- do you think we're going to see the other let's call the new generation of vendors, do you think they are seeing the same thing or do you think that this is somewhat Nimble specific because of your pull back on spending?","I think the place where the competitive intensity was particularly high was in the larger deals segment that’s become a larger part of our mix. So large deals are becoming a greater part of our mix every quarter and that's where we saw very aggressive competitive intensity from the large incumbents. To go one step further the frequency with which we compete against, let's say, younger companies, has been increasing by about one, two percentage points every quarter. And actually our win rates against those remain very consistent. So depending on the individual start up, I suspect they are seeing different competitive responses depending on whether they are competing on the high end or not.",,,,,,
Jason Ader,Suresh Vasudevan,Okay. Not having all-flash probably maybe had an impact too?,"I would say in our competitive engagements pricing action by the large vendors is by far the most dominant factor that impacted us. All-flash just this last quarter went over double-digit percentage in terms of how frequently we compete against all-flash arrays. So while it's been increasing every quarter, it's not the most material factor that impacted us, Jason.

",,,,,,
Brent Bracelin,Suresh Vasudevan,"Thank you. I just had a follow-up here on pricing and then one another follow-up as well. Historically Suresh, pricing has always been aggressive. And in the past your technology advantage has kind of more than offset some of the pricing pressure that you have seen. So first question, why is aggressive pricing now starting to impact you more so than it has in the past?","Yeah, I think, Brent, pricing has always been a factor and I’ve said this on the last two calls, pricing has been getting more and more intense. You can see in our results this quarter that pricing actually impacted our gross margin to some degree as well. So we still maintain a very substantial advantage. But as we are getting into larger and larger deals and those are accounting for greater share of our overall business, typically pricing tends to elongate sales cycle as large enterprise, so that's affecting our conversion rate. Often, I’ve also said before this, Brent, typically, incumbents get the last word on pricing and often it ends up becoming one where the customer says let me stay with the incumbent. So that's another factor we're starting to see. It's mostly a shift in the mix of our business towards really large deals that’s starting to impact us from a pricing standpoint.",,,,,,
Brent Bracelin,Suresh Vasudevan,"Got it. So kind of a combination of mix shift to large deals and then lengthening sales cycles as pricing intensifies at least in North America with these larger enterprises. As a follow-up and thinking about next year, your guidance implies product growth of 20%, 25% here for Q4. Is that the right way to think about kind of the growth rate into next year 20%, 25%? The reason why I ask that your largest competitor EMC is potentially going private next year. They’re going to be in a position to get even more aggressive on price next year, so it just seems like the structural change around pricing could be a permanent thing at least as we think about next year. And so how are you thinking about the appropriate product growth trends that given this pricing environment we should think about for next year?","Yes. So, I'll say one thing Brent. First, we don't give guidance that’s that long-term in nature. But I want to point out there are two factors that impacted us. The first factor is that in the large enterprise segment and in the large deal segment competitive pressure has been a factor that slowed us down. Perhaps the greater impact is that in going after those larger deals and in going after those larger enterprises, we shifted investments from our commercial segment where that is the second action that we are taking to avoid that shift in investments by reinvesting in our commercial segment is what we're doing. So, as you think about our corrective actions besides sort of strengthening our competitive position in the large enterprise segment by broadening our platform, investing in commercial over the next - first two quarters of next year is really what we are doing, which I think will translate into growth again. Beyond that, I don't want to get more detailed on specific growth numbers, Brent.",,,,,,
Rajesh Ghai,Suresh Vasudevan,"Thanks. So Suresh, if I back out your Fibre Channel business from the rest of the business, iSCSI, I noticed that for the last three or four quarter's [as soon as you] [ph] started shipping fiber channel, the iSCSI contribution has kind of plateaued in the high-50s. I recognized your explanation around commercial enterprise, but it appears as if most of your growth going forward is likely to come from Fibre Channel and the iSCSI market has kind of reached a level where you potentially cannot grow going forward. Is that a fair characterization, or why not?","Yeah. Rajesh I’ll go back to what I said, really there are two things going on. One, as we shifted some investment towards going after both large enterprises and larger deployments across our customer base, that’s come at the cost of investments in our traditional midsize enterprise customer base. And that's really where iSCSI was particularly strong. And so you would -- as I've said in the past, the mix of protocol is as much a reflection of our sales capacity investments as a reflection on the market. And so as I described our one of our corrective actions being focused on reinvesting in commercial that's really aimed at making sure we get midsize customers back and that tends to be more dominated by iSCSI as a protocol.",,,,,,
Rajesh Ghai,Suresh Vasudevan,"So you don't think it's going to plateau at that point, there is room for growth in both segments, on both protocols is what you're saying?

","I think that we -- that's correct. What we care more about is growth of both our commercial base as well as our large enterprise, large deal base. The protocol mix is almost an outcome. What will tend to happen is that the lower end of our business or the commercial segment of our business will tend to favor iSCSI more, the higher end will tend to favor Fibre Channel more.

",,,,,,
Alex Kurtz,Suresh Vasudevan,"Yeah. Thanks guys. Just quick question, Suresh, on this commercial activity. You know if you look at the new customer adds in the quarter, they are still pretty strong and towards the high end of where you have executed over the last couple of years. So I guess the question is you know it still seemed like you executed at some level on the commercial business. What I am trying to solve for is what's underneath that miss executed. Because you added a lot of new logos in the quarter, was it just sort of follow-on business with the existing installed base of commercial accounts where you didn't have those investments to follow up on those accounts and drive incremental revenue?","Yeah. That's a good question. Let me start by saying our sort of land and expand model is as consistent as it's always been, so once we land a customer the pattern of repeat purchases as steady as ever. And you are right, that it was a quarter were customer acquisition was very strong. But what we had invested in was the larger deals which are not as much a reflection on customer count as much as deal sizes and really large deals. What we'd invested in was making that a larger part of our business. And so as that has pressure the number of new customers in the mid-size enterprise had to be even larger than we landed to make up for that shift in investment. So that's really what underpinned our results.",,,,,,
Alex Kurtz,Suresh Vasudevan,"It sounds like the October guidance from an enterprise perspective you guys assumed some large deals in the enterprise side we're going to close, right?
","That is exactly right.

",,,,,,
Alex Kurtz,Anup Singh,"It sounds like the October guidance from an enterprise perspective you guys assumed some large deals in the enterprise side we're going to close, right?
",That’s right.,,,,,,
Alex Kurtz,Suresh Vasudevan,"It sounds like the October guidance from an enterprise perspective you guys assumed some large deals in the enterprise side we're going to close, right?
","That is exactly right. Large deals and large enterprises were not as significant a contributor as we had modeled and we pulled investment from commercial to make that happen which reflected in not enough in the commercial side.
",,,,,,
Alex Kurtz,Suresh Vasudevan,"And just last question for the January guide, are you dialing back the assumption on enterprise execution or is it roughly the same where you had it for October?
","Well, so our belief is that the competitive intensity is which is what drove the lower than anticipated productivity in our enterprise side is going to stay in place for the next several quarters particularly as the larger incumbents are defending not just slow growth, but declining revenue we anticipate that, that will stay in place and that's really what we factored into how we think about Q4 guide.

",,,,,,
George Iwanyc,Suresh Vasudevan,"Thank you for taking my question. Can you give us a sense of when you started to see the weakness emerged and how you feel about your long-term targets given the price pressure? Are you updating what you think margins can reach in several of your timeframe?
","Yes. Let me start with the first part of the question. It was really pressure that we saw throughout Q3. Typically Q3 for us tends to be a less linear quarter because of the summer and normally month three tends to be the stronger part of Q3 even compared to normal linearity. For us this quarter throughout we noticed that there was more competitive intensity and certainly that carried on through month three. Now on the question of how do we think about our long-term, even in a quarter where we've had aggressive racing action by competitors, our gross margin is well above our target norms. So it's our product gross margin that held up well even in an environment that is intense competitive intensity. So we are not changing what our belief is about our long-term gross margin model. Secondly when you look at our mature commercial teams, they are operating well above breakeven levels of productively. So we already know that there is a marketing investment support the kind of business model that we are trying to build. What I think you are really seeing is a transition in the marketplace and not – and that's really what's causing sort of more probation in the short-term. We are not changing our perspective on what the long-term business model looks like.",,,,,,
"Simona Jankowski
",Suresh Vasudevan,"Hi. Thank you very much. I certainly appreciate some of the tactical issues you highlighted in terms of the focus on commercial versus enterprise and then the competitive backdrop. But just in terms of some of the more strategic decisions around the roadmap. How do you feel about a couple of areas the choice of focusing on fiber channel versus for example, hyper-converged infrastructures which does seem to be gaining traction and then also the timing of the flash products? How you think about that and if you think that will be helpful in giving you another tool to battle some of the industry dynamics?","Yeah Simona, let me start with the second part of your question which is really around the flash, All-Flash product question. As I said before, we absolutely believe that having the broad platform that spans every workload is important. We have also said that we have a very concrete plan for broadening our flash platform to compete in the entire space and that is still very much on target. You’d expect to see us -- you should expect to see us participating in the entire market with both hybrid flash and all-flash market if you will. The second question really around hyper-convergence versus convergence versus standalone storage. We still continue to believe while there is growth in hyper-convergence in certain workloads there is enormous growth in both standalone flash centric storage as well as converged flash centric storage. We still believe we have a very strong platform to address the entire spectrum of flash centric storage requirements and our partnership with Cisco and creating SmartStack converged infrastructure allowing us to participate really well in converged deployment. So, I think the pace at which we're executing are roadmap and the direction of the roadmap very, very strong confidence in where we're headed.",,,,,,
John Roy,Anup Singh,"Hi. It's John Roy in for Steve. Quickly on your profitability, obviously, it’s not going to come next quarter. Do you have any type of color you can give us on when it might be? And also, are you still seeing a 3x to 4x advantage in pricing even though with the discounting?
","So, John, this is Anup. On the question of getting to profitability, the way we’re thinking about it is the investments we’ve talked in the first half of the year for next year is going to lead to a decrease in leverage as compared to margins of this year. So, if you compare first-half to first-half, you'll see a decrease in leverage. We expect however the investment that we're making that Suresh articulated will have an impact starting the second half of next year and therefore we should get back to showing an improvement and leverage in the model in the second half of next year as compared to the second half of this year. Apart from that at this stage, we are not offering of any guidance in terms of the long-term sort of break even or the past profitability.",,,,,,
John Roy,Anup Singh,"Hi. It's John Roy in for Steve. Quickly on your profitability, obviously, it’s not going to come next quarter. Do you have any type of color you can give us on when it might be? And also, are you still seeing a 3x to 4x advantage in pricing even though with the discounting?
","And John on price performance it very much remains in place. I think as I have said before what we're witnessing are instances, numerous instances where our competitors already over the last few quarters I have said they are coming close to that cost in order to hold us off, particularly in large accounts and large deployments. We are witnessing even stronger pricing pressure where they're going under the cost in order to retain footprint. And as you can see, we don't back away just because someone is taking aggressive price, even with the pricing pressure our gross margin stays very strong. So price performance advantage is best reflected in how our margins are performed very much still in place.
",,,,,,
John Roy,Suresh Vasudevan,"Great. And did you see the pressure more coming from NetApp or from EMC?
","No I think I'd say it's equally from EMC as well as NetApp and I would say HP as well. So the top four vendors for us have all almost sort of a reaction to e-serve all becomes much more price aggressive.
",,,,,,
Amit Daryanani,Suresh Vasudevan,"Thanks a lot. Good afternoon guys. I guess just following on that question, Anup, it's you from I guess replying backward pricing or competitive pressure on your own side because your gross margins are ahead of your own locking target. Do you now see there is enough price velocity I guess in this marketplace for you to lower margin and potentially take more share and hit those targets you've had in the past?","Yeah. Amit, this is a good question. I think we have answered -- address this before as well and I will say this on any given deal typically we don't walk away because there is a point at which we are not willing to match our competitor on price. In larger deals what we tend to see sort of happening as a result of price is two things. One, the customer evaluation cycle gets longer and so often deals that we've noticed a greater than 10% elongation in our sales cycle, as customer spend more time sort of going back and forth if you will on the decision-making and that's one factor. The second factor is in many instances the last word the long's to the incumbent. In many instances when EMC or NetApp's say they are willing to go all the way down in price to hold off any single project that tends to be the barrier. What we have also noticed is every one of those instances is one where we go back on the next project or the project after that to the same customer. So you may lose a project on price, but inevitably the fact that we have been evaluated by the customer who keeps the door open for us.",,,,,,
Amit Daryanani,Suresh Vasudevan,"Got it. And then on the second part when you talk about shifting investment from commercial enterprises on performance. I missed this in the past, but what exactly did you stop investing on the commercial side that's hurting you and what exactly investing to help you?

","There are really three changes that impacted us. One is when we look at a mix of teams that we brought on board, over half of the teams in the last four quarters have been non-commercial teams named account teams. So number of sales teams we are adding is lower in the commercial segment than traditionally has been. That is the first thing. The second one which has even more short-term impact is we have a lot of marketing programs, channel programs aimed at opportunity generation and these are fairly short-cycle opportunity generation. Typically 75 to 90 days cycles in which they convert and so we pull investments from both marketing and channel or shifted investments toward larger enterprise wins rather than commercial wins. Both of those investments that we intend to grow back and add again in our business model.",,,,,,
Aaron Rakers,Anup Singh,"Thanks. I want to build on that question. I believe, Anup there was a third item there. I'm sorry I didn’t -- I heard one and two but I didn't catch number three. What was the third item in terms of pulling back on the commercial side?","It’s a marketing which says that’s one and third one is channel programs. So we have about half of our opportunities are marketing sourced, another half of our opportunities are channel sourced.
",,,,,,
Aaron Rakers,Suresh Vasudevan,"Okay. And with that said with that point I believe in the past you've always talked about long-term model as kind of mid-60% product gross margin, should we now assume that we’re trending to that level quicker than what previously maybe you would have thought given those incremental investments and if so when do you think we should maybe think about mid-60s rather than the 68% you’ve been running out?
","Yes. So, I think we expect the competitive environment to continue. Certainly the discounting and pricing environment we are currently in. Our long-term target for margins, for products is in the 64% to 66 % range. We still are comfortably above that. Our margins and products are about 68. We think that this will trend down a bit over a time. Our support and service you might have noticed is going up. So to some extent it's offset out on margins over all. But definitely I think incrementally over time, we're going to start to approach our long-term model.",,,,,,
Aaron Rakers,Suresh Vasudevan,So what's your product gross margin assumption this current quarter?,"We don't offer up the details -- the guidance on margin Aaron. But in offering up the guidance for Q4 as we said, we've taken the competitive environment into account and we have modeled it accordingly.
",,,,,,
Aaron Rakers,Suresh Vasudevan,"Okay. And final question for me is on the enterprise productivity, I'm just kind of curious -- where do we stand on the productivity curve maybe relative to what you would have thought of may be coming out of the July quarter and -- as you bring on these new named account teams, just remind us again how long it takes us to see them ramp to that kind of targeted productivity?
","Yes so I think we are not actually giving you specifics on the past. Let me just say what we have said in the past is typically our commercial teams Aaron takes around four quarters before they are on the same curve as our mature teams. And enterprise teams, we had said, sort of was slightly longer than that. What we are now seeing is that full productivity of our enterprise teams is perhaps four quarters longer than our commercial teams and that's really sort of is how we are seeing this. It takes about a couple of years before enterprise teams yield the kind of full productivity that we are looking for.",,,,,,
Katy Huberty,Suresh Vasudevan,"Thanks. Good afternoon. I guess looking forward, what changes in large enterprise given that the incumbents are willing to price aggressively and they get the last bid. What can you do to change those dynamics? And then secondly, should we now assume that the goal of breakeven is off the table until you start to see that enterprise business really ramp as expected? Thank you.

","Yes. Let me address the first one, Katie. I want to start by saying, when you look at our business in terms of mix of Fibre Channel, when you look at our business in terms of bookings from deals over 250,000, 500,000 notwithstanding the competitive environment and the pricing environment those are growing and growing faster than our overall business. And they are becoming a larger portion of our mix. And so let me start by saying that the trajectory of what we're seeing at the high-end of our business is moving along well. Our concern is that the kind of return we wanted from our investments, we were essentially looking for more leverage in those investments than we're seeing. So, it's more a question of how long before they become as productive as our commercial segment rather than that we are not able to make progress. So, it's much more of profitability question rather than success in the enterprise question. Now with that said, that goes back to your second part of the question which is, what do we expect from a profitability standpoint? It is true that we've not given specific guidance on when we expect to get back to breakeven. The investments we’re making in the first we believe will take the first half of next year and that's when we're going to see sort of most of the investments concentrated. And so second half you should start to say leverage again in our model relative to this year. Beyond that we're not getting specific on what that translates into for breakeven.",,,,,,
Brian Alexander,Anup Singh,"Yeah. Thanks. To what extent do you think public cloud adoption AWS and the like is having an impact on revenue trends for either your enterprise customers or your commercial customers? And then maybe just a little bit more quantification on the magnitude of investments that you're planning in terms of number of hires, headcount et cetera. I'm just trying to get a sense for the pace of investment and how that's going to change over the next few quarters. Thanks.","Ryan with regard to the investment question and try to quantify that. I think as we have said we're making investments in the business especially in the first half of next year that we believe will reaccelerate our growth in the future. And as I alluded to before, the leverage as a result of those investments in the first half of the year will be negative as compared to this year. We expect to see the leverage improving in the second half of next year as we see the benefits of those investments. The other thing I would say as we look at our overall investments, we are doing is somewhat of a careful assessment of spending in to other areas of the business as we increase our investment in these areas of sales and marketing and the commercial business and then broadening the platform that we have. So we're going to be cautious and looking for leverage in other areas of the business, but we expect our investments to start to pay-off in the second half of next year.

",,,,,,
