asker,responder,question,answer,Unnamed: 4,Unnamed: 5,Unnamed: 6,Clear,Assertive,Cautious,Optimistic,Specific,Relevant
Nigel Coe,Ronald L. Hoffman,"Okay, fair enough. I mean just one more question, if I may. I mean natural gas prices have obviously spiked. That's generally good for gas drilling in the U.S., which is obviously good news for you. Are you seeing increasing activity in that field?","We are somewhat over weighted on the natural gas side. If you look at our Energy group, as a general rule, we benefit more from gas drilling than oil drilling.
",,,,,,,,,
Matt,Robert G. Kuhbach,"Of the 1.5 billion that you spend on metals, could you give us a sense of how much of that is protected through long-term agreements or how much of your spend in the second quarter was at current prices or what had been protected before?","I think the one to clarify for you, Matt that the 1.5 billion was an annual spend.",,,,,,,,,
Matt,Robert G. Kuhbach,"Right, yes. And so of the portion that was in the quarter, how much of that would have been protected through longer term supply agreements?","A number of our companies have long-term hedging agreements to try to minimize their price increases. I will say those have been much more difficult to enforce as we [ph] progress through the course of the year. But again, we're very comfortable in the second quarter that we did recover the majority of the price increases, whether they be through pricing or through internal improvement initiatives. So there was a significant impact in the second quarter. I think that will become a steeper challenge as we move throughout the remainder of the year.",,,,,,,,,
Matt,Paul E. Goldberg,"Right, yes. And so of the portion that was in the quarter, how much of that would have been protected through longer term supply agreements?","And I would just say, Matt, that we don't have that number in exact detail. But I would say more recovery was through price increases than hedging from my knowledge of the business.",,,,,,,,,
