Asker,Responder,Question,Answer
Michael Nathanson,Chase Carey," And what type of follow-up in there, what type of ad growth is assumed to get to a billion OI and when you said modest ad growth, is it between low-single digit growth element?"," Yes, we’re assuming a pretty mean growth. I think our view of the economy right now would probably be, you’ve got sort of a pretty low growth economy and obviously look at the short-term the ad market, right. We’re sitting here with scatter pricing that is more than a third of the up front and we’re not assuming that we’re assuming, you’re going to have an ad market that is pretty modest growth that sort of reflects an economy that I think we do assume right now is pretty modest growth."
Richard Greenfield,Chase Carey," Hi, just couple of questions following on the current technology side. When you look at doing things on the movie side with your content in terms of early release, video on demand or selling your content early in a digital window, wondering kind how your plans are evolving on that front? And then two, when you’re talk about the strength of the RSNs, with the prospect of an NBA strike next year, how do you look at, A, how big of an impact is basketball to the RSNs overall? And is there any plans in terms of other programming that could be shifted around, and just how you’re thinking about that overall would be great? Thanks."," Yeah, on the movie side, I guess early windows specifically electronic distribution I guess more broadly and I think it’s very important for us. I think the early window, its not 30 days, its 60 days I think is an important opportunity for us to create something that isn’t, it is a different experience. I think it’s different than the theatre. Theatrical side is important to us. We need to make sure we protect the strengths of that. But I think that window to get it properly priced and it’s something, I think it’s something you’ll see in short-term and certainly I think the first half of this year you’ll see people moving forward there. I think the broader electronic distribution is equally important. I think we need to make sure, if you ask me the most attractive part of it is we can price our product and looking at, price experience in a way that gets us fair value and I don't think sort of whatever short-term windows that get us a dollar a rental is fair value for our product and these electronic distribution platforms enable us to get there and to put appropriate pricing, fair pricing on our product in various windows. So I think we should be aggressively developing these distribution platforms. RSNs, a strike is always tough to sort of, you don’t know it’s going to last, A, is it going to happen, is it going to last a day, is it going to last a month, is it going to last what have you. So I don’t think it’ll last forever, so you're not making, there are limits down much you could really make plans for something that probably as a realistic outside to it that isn't that long. Basketball's important to us, I think we try to do we could, whether it means next college games or things we could go after and we try to mitigate it, but we’re not in these, so we hope these strikes don't happen. We hope already they reach settlements. But I think as we get some little visibility and predictability at the time, you sort of probably do what you can in the very short term to mitigate, but stuffed up that’s really makes significant plans and given just the nature of the uncertainty around it."
Robert Andrews,Chase Carey," Hi, thanks. So back to MySpace, you’ve mentioned that the company’s interest maybe best served with another owner. So if the company is (Inaudible) I wondered if you might try to comment on what climate will you have on best served MySpace interest and most of this they want probably MySpace could you provide to percentage of data."," Not sure I got all that, but we’ll just try to interpolate on it. Yeah, there has been a lot of interest, because there has been some indication, we’re pursuing that path. In other words peruse all options that can range not just a sale, but it could be you know a sale could be an investor coming into it, it could be us staying with a restructured ownership structure with management. We just think in fresh perspective with given flexibility and opportunity to really get a new life is consistent with the re launch of the product end up right sizing up the cost. The interest to-date is ranged from A to Z, from industry players, financial players, to foreign to domestic and that’s without really being out there. It’s sort of incoming. We’re not soliciting anything at this point, but we think we’ll look at all of those. I'm not going to speculate on value. We think it's a business that has got a unique level of reach and while it’s in a restructuring place has proven, put forth a path that we think has a real future to it and that we think, it has an opportunity to really be something special, but we think we ought to put it in the right place to really maximize that opportunity. I think management, the senior management there is excited. I mean obviously there has been a lot of challenges for them, but I think really believe that I’m – that they can do something special. But I think there’s, the interest sort of ranges from A to Z."
Staci Kramer,David F. DeVoe," Hi, Dave. I’m sorry I couldn’t make it today, but I wonder if you could just back to the daily financing for a second and clear out something, can you say what the first year expected costs and how the 30 million fits in?",The first years expected cost is $30 million.
Staci Kramer,David F. DeVoe,Okay.," Approximately, okay. So $30 million."
Staci Kramer,David F. DeVoe,All right. And then so within that is the half million a week?," Yes, that’s correct."
Staci Kramer,David F. DeVoe,All right.," So you get more cost in the short period of year, because you got start up cost associated whether you got, marketing…"
Staci Kramer,David F. DeVoe,So that you expected to run $30 million for the first year or $30 million plus that?,$30 million for our first fiscal.
Staci Kramer,Chase Carey,Okay.," And that obviously doesn’t, that’s cost (Inaudible) so obviously we do certainly have revenue."
Staci Kramer,David F. DeVoe," Okay. So when you come back at it and look at it, whether you can make a profit on it that $30 million will factor in, right?"," Yes, that’s going to give $500,000 a week a total cost."
Staci Kramer,David F. DeVoe," Okay. I don’t mean if I’m dense about it. There has been a lot of numbers thrown around today and there are a lot of people interpreting them in different ways, so I appreciate you’re clearing.",Does that make sense though?
Staci Kramer,Chase Carey," I think, I think it does, you know, also there is some suggestion today from Mr. Murdoch on Fox Business Network that Apple might be willing to renegotiate the 30% split after the first year, is that something you can address further?",(Inaudible) comment our private conversations.
