Asker,Responder,Question,Answer
Andrew Edgecliffe,Chase Carey," Thank you. Chase, on SKY, can you tell us, are you still committed to that SKY deal after the political thing in London, and has SKY's recent strong performance changed your view on your initial 700 pence a share valuation at all?",We believe and we continue to believe we made a full and fair offer and we are going to approach this in a disciplined manner. Our focus on it is on the regulatory process and we're trying to move forward with that. That's probably really all I've got on it at this point.
Anthony Diclemente,Chase Carey," Thank you. Just been listening to the conversation about monetizing content, I'm wondering, Chase, how does Hulu fit into your vision of monetizing Fox content? You had mentioned I'm just wondering if you still view Hulu as a mechanism to get fair value. And then as a second question, we keep hearing from other studios like Warner Bros and CBS that the TV syndication market continues to be a robust market in terms of value. Just wondering if you're seeing that, and then in your mind, what are really the true drivers of that improvement in the TV syndication market? Thank you."," No, for sure. Hulu, they’ve done a great job and they continue to grow. I think they have launched a subscription dimension to it. We think that's an important dimension. I think we are believers in dual revenue stream. So it adds up, I think it adds a dynamic, provides opportunities. And I think the digital marketplace is going to continue to evolve and I think Hulu has created a fabulous brand. I think they’ve done a great job creating a great experience. Obviously, they can speak for themselves, so I’m not going to speak too much about their strategy, but I think they’ve developed an enormous following and set of fans and I think we’re well-positioned to continue to take advantage of these emerging digital marketplaces, but it looks like the dual revenue I think are important for them and built on content, so it's important for us. I think what we're going to try to continue to make sure is we feel our content's being, again, I'll use the same phrase properly monetized in all those digital models including Google."
Anthony Diclemente,Chase Carey," Okay, fair enough."," TV generates, you mean that the content owner selling in the syndication market? Were you just taking about the strength in that regard?"
Anthony Diclemente,Chase Carey," Yeah, just talking about…"," I guess I talked about Modern Family. I guess we would [second] (inaudible) Modern Family I think will be the highest first cycle show ever sold into the marketplace and I think what's driving it is that we have good shows. I mean, I think as people get more and more choices, I think where you get hurt is if you're sort of chopped liver in the middle and if you got hits, I think the value it hits is bigger than ever. You’ve got the NFL or American Idol, Glee, the ability and owner of Modern Family is not always the owner network but when you have those types of shows they have extraordinary value, importance, and power. And I think TV continues to prove itself as a sort of something of importance to consumers and value advertisers second to none. I mean you look at the ad market, as I said, on these national broadcaster cable networks, demand from an advertising perspective is incredible. And I think it shows the power of television, power to importance to consumers or the power to advertisers. And if you guy hit shows that stand out in a world of 200 channels, it's value."
Anthony Diclemente,Chase Carey," Well let me ask it this way. Is that value increasing because of the emergence of new digital networks and services, like over the top networks, or in spite of them?"," And I guess, yeah, I'm not sure, you could argue both, I think it’s like the TV and sort of go back of a value of a bundle. I mean, I could argue and I would argue today, the TV experience is a much richer one and much more rewarding one for consumers who get choice all the time in an array of things more ways to access the products, more technologies get put out there, so I think it is sort of it is a richer experience but I think equally you could end up saying it's sort of hits. As you get more choice, the hits just become more unique and more important but and I probably argue probably either. I’d argue it from the left or the right, it’s sort of a glass half full, glass half empty I think."
Brian Stelter,Chase Carey," Well, thank you all. Is Fox considering withdrawing or reducing the amount of content on Hulu and can you reiterate your point of view toward Hulu, is it evolving?"," Yeah, I think I said before I think Hulu – I think that Hulu is continuing to evolve obviously that in some ways the launch of Hulu Plus is an evolution to add a new dimension to Hulu. And right now, we’re pretty much started dealing with Hulu the same way we historically have."
Brian Stelter,Chase Carey,But are you considering reducing the amount of content?," (Inaudible) digital platform, you have to continue to evolve."
Brian Stelter,Chase Carey,So you may have to reduce the amount of content on it.," No, I’d say we’re going to continue to deal with Hulu from a content perspective, consist the way we have."
Chase Carey,Benjamin Swinburne," I think for content owners having players like Netflix emerge and certainly has real pop to it to the sense they are another buyer of our product. And I think that’s largely with somebody like, I just think with Fox.com which is like the I think it’s the line is soft of currencies and products which is really more where the fox.com reside and sort of a delayed access to current product which is different than sort of the, where the Netflix (Inaudible) which is more what I consider library product. I mean product and with the effort and they may all, obviously those things can change but I do think they are different and to the degree Netflix is like a deal item. I read the Disney deal, I don’t remember the specific product, but to the degree it’s where you talk Moderate Family. To the degree they are looking to compete for sort of library rights. I think largely they are competing with other sort of network type buyers and I think increasingly you are going to have, when the competitor is not co-sharing, there’ll be competitors. And I think probably channels like to say if I’m going to pay a lot of money for Modern Family I want to buy it upright but it’s not showing up on a competing platform. At least I know what it is for adjusting my value and I think for us as a buyer because we’re a buyer as well in FX, I would not be buying reruns, indication rights to a an expensive piece of programming and letting it go reside on Netflix for 20 million copies up. Yeah I think that’s, the place they reside it is, I think how I look at it. We have to make sure that we’re getting fair value for our product. We shouldn’t be selling it cheap and I think at times people have sold their products cheap. I think the Star’s deal with Netflix is probably the ultimate example of product being sold beyond cheap. And I think we can get fair value for our products. There are other buyer for our product and other medium for our product. You may have to set a few merge to library values where you have cable channel syndication and digital networks that are competing for these rights. And I think the buyer is always right after you shake out. I know how, we are a buyer on the FX side. I know how we’ll approach it and we are going to, I think we will certainly look at all those in distribution platforms and address what we’re willing to bid or what we are willing to bid or what we’re willing pay based on where it’s being distributed. So, I think that’s how I look at it. I think, obviously we need to meet our project cores, we need to make sure we’re going to fair value for our product in whatever one of these distribution channels we’re dealing with.",Thank you.
David Bank,Chase Carey," Thanks, very much. Two questions, first could you talk a little bit about how the local stations grew revenue in December post political and how they’re pacing in the first quarter versus the impact of political? And second, could you talk a little about that you are now half way though the year that Myspace restructuring is in process. What do you think is embedded in your guidance kind of a base case expectation for Myspace losses for the year or earnings? Thanks."," I think in terms of the TV stations, there are some ups and down, you look at this quarter on pages, we didn’t have the BCFs, we do have the Super Ball in the third quarter, I think third quarter, we’re looking at pacings that are probably low-double digits as pacing what was on Myspace. Again, I think like our focus is going to be really said on the strategic options, I think if you look at it financially."
David Bank,Chase Carey,You’re not going to show a very large improvement.," Yeah. Now I think anything financially be a bit better than the first half, but not, while it’ll be better than the first half but I think our focus is really set on pursuing the strategic options for it."
Douglas Mitchelson,Chase Carey," Thanks so much. You know I think I’m just going to follow up on Jessica’s question, if that’s okay. You just said, Chase an array of digital platforms, are you referencing the potential to license your cable networks down line aggregators, or are you just really talking about shows and movies and the opportunity to monetize them in different windows?"," No, I mean authentication I'm really talking about sort of the ability to going to have that sort of add on to the core programming package of wherever it come from, what you want to see, when you want to see it, you know, where you want to see it. And provide that experience and provide it in a rewarding way and I think that rewarding way isn’t simply saying you can see it on cablecompany.com or fox.com and that’s your only two choices as opposed to saying, you can get that type of experience in an array of places. But I am really talking about this sort of the enhanced experience what you think is authenticate. And authentication is about, it’s adding the enhanced experience of getting what you want, where you want, when you want it on top of the core-programming package."
Douglas Mitchelson,Chase Carey,Is your vision for the next few years at the current cable satellite distribution in ecosystems stays in place when it comes to your live channels?," Yeah, I don’t assume it like, I truly believe the value of that, I understand that we have to take less, the value what they get in that package is fabulous. I think the breadth of what you got there is unique when it covers sort of from sports to news, to entertainment and the like. And I think in American households today live on it, maybe not every 23 year old understand, but I think it is kind of everything to see about it. Any of the noise about the pressures today I think are really economically driven at a tough time when you have people struggling with unemployment rate where it is that have to make in a very difficult and the trade-offs in the day-to-day life, but I think the value for this package and the importance of it, has real legs to it."
Douglas Mitchelson,Chase Carey," And then I’m just intrigued by you comment at second half Cable Network growth looks stronger than the first half, is it fair to say then that March quarter domestic ad pacing for cable networks could be accelerated for what we just saw in the December quarter?"," Yeah, and first it's not doubling, I mean it’s strong, I mean it's not, right now it feels its not stronger so I wouldn’t, it's not like it exploded in the second half, but it's not stronger than it was in the first half."
Georg Szalai,Chase Carey," Thank you. Chase, I was just wondering if you can give us some color on the expected timing on the Myspace decision and on the premium VOD movie launch. Is it both something that we should expect by mid-year or, can you give us some color there?"," I think on MySpace we're actively engaged in pursuing those strategic options now. And I think as I said, I think, I think the, you know, early went [out], I think guess you something you see in the first half there."
James Dix,Chase Carey," Good afternoon gentlemen. Two quick ones. Given that your international cable growth was so strong over ad growth of 27% in the quarter, operating growth, profit growth of 37%, is your expectation with that too can accelerate in the second half of the year, is there something which is going to cause that to moderate. And then just secondly, now that you are sit here at the midpoint of the fiscal year, is your expectation for the mix of operating income for the full year now more weighted to cable and TV or is there something in the seasonality for the second half that is what kind of your expectation for that mix growth probably unchanged versus when you’re originally gave your guidance? Thanks."," I think in the international channels to be strong in the first half and that we expect to sort of sustained similar strength through the second half, I mean it’s strong (Inaudible) pretty happy, we will just keep rolling along like as well and so."
James Mitchell,Chase Carey," Great, thank you for taking my question. SKY Italia had a very strong gross net ad trends in the quarter. Were there any unusual factors helping growth in the quarter other than the prior re-tiering, and how do you feel about subscriber growth at SKY Italia in calendar '11 without the World Cup?"," First there was nothing unusual in the quarter. Yeah, I think we’ve sort of talked about little bit about middle of the calendar year that we had digested in the prior time a number of events and I think we got our footing and you can have some packages and made some adjustments to the fact we can’t buy ad time on media that will sell ad time and the like and got our mojo back and sort of I think they have done a good job and look we got a better package. We got the offerings that should be the dominant one there. And I think they’re doing good things and I expect that momentum to continue. And I think our focus right now is really on growing the business. This is a country still that is not, is still sort of third penetrated in terms of pay. It’s got a lot of growth left in the market and we think it's important at this point in time, that sort of where is the focus is to take share. And we’ve got to manage all lines, but I think it’s a real opportunity for us to what, to do that. And hopefully, Dave mentioned 5 million sub milestones, but it’s a big country that loves TV. So we feel great about the long-term future of this business."
Jason Bazinet,Chase Carey," And a questions from Mr. Carey, you know you talked about retooling your businesses for a digital world, and its seems like there is a, maybe it’s not a new business, but it tweak to the existing industry practice that’s makes a lot sense to me, I just love to get your reaction, your affiliate fees are all charged on a per household basis, which makes it expensive for peoples who live alone to watch Television relative to families. It also sort of exposes you to piracy as you go down this authentication model, where people could sort of share passwords with one another, why wouldn’t be industry sort of move to an affiliate fee per connected device and sort of make TV more affordable for singles and extract more money from families with five TVs and three iPads and also sort of limit the piracy risk from this authentication model that’s emerging?"," Well, I guess two different questions. I mean, I think on a per device range, I think actually in some degree, I mean like DirecTV that you do have, we don’t as a channel provider, but you take DirecTV, I think that you have a per device, because you need a set top box, so they can charge, so they can change you 5 or 6 bucks for, and I think actually cable guys, now they are moving to digital unless to an analog you just plug it in. They can call it a box fee or something, but there is an incremental – there is an increment at the consumer level for whether you have one, two, three or four TVs hooked up."
Jason Bazinet,Chase Carey,I’m talking more on your cable networks business.," Yeah, so I guess, yeah, I’m not sure there’s a lot outside in avenue (Inaudible) like that we ended, I guess I would say for all us, we have pretty good business model today, I’m actually sort of trying to figure out how to move the chairs around on the deck to get to a better place, you are not going through a lot of dynamics to get to a roughly the same place on a different set of business model. I’m not sure what’s your keys, I mean I don’t know that it makes it difference to the consumers since they are paying. So it’s really just through an open distributor just sort of gets a charge less in this way, but more this way. And if you get to the same place, I guess you went through a lot to get, I’m not sure where since their business model already contains it. I think piracy is probably a different, but probably trade is important for us. I think you talked about something like authentication and there’s no question. I think your early generations, if they never can get some traction, proper tractions, we will probably be imperfect to best, but I think it’s important to start to move and get to have it. And obviously you got to be user-friendly, easy to sign-in and easy to use and somebody and then figure out overtime you close the holes and you get too better and more. So I think people ultimately, you got to deal with piracy and the like, but it's a very good experience to have fair price and people who will pay their pricing. But I'm not sure the piracy, which has that, I don't see that as part of that per device, because that really is depended on the infrastructure to lever things and the like. I'm not sure, how you’re charging would change would address the piracy issue. As you move to these multiple platforms, like it’s going to…"
Jessica Reif Cohen,Chase Carey," Hi, I have two questions. One was just sort of a follow on to Michael question. Could you give me some color Chase on advertising really across the platforms? It sounds like there is strength pretty much on every platform in every market and I was just wondering if you can give us some color going into the March quarter? And then secondly can you talk to us about, just give us your views on TV Everywhere? Do you think it’s important for your channels to participate and where are you in deals?"," On the advertising markets, it is really strong. I mean seriously TV is leading and I guess I would say National TV in particular. So when you look at the broadcast network and when I touched the scatter the Cable Networks and right now Cable, second half growth looks stronger than the first half growth. And so it is certainly very good. It is good in the station side. The comps get tougher in the station side. So year-on-year we’re not going to have the type of year-on-year growth in the second and the third quarter that we did in the first two. But it's really good solid growth and really across the broadcast platforms ad revenues, I mean across the newspaper be it both Dow Jones, UK, Australia are all up. They are not up like the TV business but it’s double-digit. But they’re, I think that they’re up and it’s getting to look pretty good. And obviously we have the Super Bowl on top of it falling in on Sunday."
Jessica Reif Cohen,Chase Carey,International cable network?," I mean international, yeah international it’s somewhat higher than the domestic. So, the International Networks on pretty almost any front you want to look at are doing great. And I think that the fact we have this quarter and observe the fight with EchoStar and the fights with Cablevision which were both lax in the quarter and come out with those results, that affected both profits, ad dollars and the like as it speaks to the strength of the businesses. But the International Cable Networks would be leading it and certainly there is nothing seems to be anything slowing it down as we look at the second half of the year. What did you say the second…"
Jessica Reif Cohen,Chase Carey," It was on TV Everywhere, just on your views on where you are?"," I think it's again, I prefer to call it authentication because I think it's a better price I think it sort of as you move forward into an array of digital platforms, how you package it and create value out of it. So I think it's a good thing, I think it's a bit of a, it has struggled to get going. I think to some degree it’s been encumbered by a cable industry that tries to create too many walls around it. I think if, it is going to be enhanced a bit. It was approached in a more open like where it had a more of an opportunity for an array of digital platforms to consist in an authenticated world. And I think it will be a good thing if we get some traction. But do I think its, but it’s got a, like at the end of the day its success is going to be built on making it a good experience for the consumers and if you turn to find other options which is like I think cable industry ought to sort of, the cable satellite industry just about, the distribution industry ought to find a way to make it more open and enticing and appealing and an opportunity for consumers and what does it do a good job and succeed, because then if they, consumers are going to migrate to where to the experiences they value and like. But I think authentication is an important initiative and something we'd like to see succeed even it’s a little frustrating, it’s been talked about for two years and still hasn’t yet gotten very far."
Jolanta Masojada,Chase Carey," Thanks very much. Chase, I wondered if you could talk through the economics of The Daily. What's the total investment, when are you looking for it to achieve break-even, and what are the implications for your newspaper strategy more broadly?",I’m sorry I did miss the last one though. What was your last question?
Jolanta Masojada,Chase Carey," Well, the last part is what are the implications of The Daily launch for your newspaper strategy in other markets?"," Okay. Guess the last part first. The Daily's not a newspaper product. It's a news product. We're in the news business, just as Fox News is in the news but I think the [incentive] today is the launch of this. It's a news product that’s taking advantage of a new technological platforms, the tablet or the iPad and I don't think you should think about it as sort of big part of our newspaper business or as part of our television business. So it’s a, I think we have great expertise in news across an array of existing platforms and this is taking advantages of that expertise in news to create a product for this new digital world and relatively I think we should be doing that with all our brands and our content, I mean I think to me that’s the sweet spot for us in digital. I'm not going to rule out sort of finding things in the dot com world, but I think for us the digital places we bring unique strengths or when we could take our brands and our expertise and our content and figure out how do you develop digital extensions or digital experiences based on the content brands that we have and we’ve got fabulous ones around the world. And I think one of great things about these digital platforms which will get to the back is, realistically you can create them, in a whole different at a pretty modest level of investment in the whole different scale, because you don't have all the other thing that go with it, I mean you don’t have, compared to newspapers, you don’t have paper distribution returns and the rest in lot of the infrastructure that goes with all these businesses. I think that’s quite adamant on that but really about five hours into its launch I’m probably not going to put a break even day."
Michael Nathanson,Chase Carey," Thanks. I have one for Chase and a quick one for Dave. Chase, you mentioned a target of $1 billion OI in TV in a couple of years from now, I wonder could you give us a sense of how big retrans will play in that role in terms of the size of retrans for you and reverse retrans given you’ve done some deals already? So can you take us from where it looks like now to two, three years from now retrans and reverse retrans?"," When you say reverse retrans, you mean with the affiliates?"
Michael Nathanson,Chase Carey," Yeah, exactly. So how much of that billion or so is coming from those two new revenue lines?"," Yeah, I mean its revenue and I guess it’s a little bit, I mean the billions of profit numbers. Obviously retrans is a revenue so, but probably not going to specific dollar on it, there has been a fair amount out there about how what we are looking to get for it. So that’s sort of the speculation speak for itself. Yeah, I think we’ve got, I think we’re pretty well sort of defined the market for us in terms of the O&O. The affiliate side is probably, we are more actively engaged in right now. Well, I guess its big numbers. This is certainly, it’s hundreds of millions of dollars. It change with the nature of this business. And in many ways, I think that broadcast network should look like a cable network and it should have two real meaningful streams of revenue, subscription and advertising as we look for this to be a significant part of the revenue for that broadcast business."
